Project title,Principal investigator(s),Co-investigator(s),Keywords,CIHR contribution,ApplID,Abstract/Summary
An Integrated Real-time Modeling and Surveillance Decision-support Framework to Inform Public Health Emergency Preparedness,"['Pourbohloul, Babak', 'Henry, Bonnie J']","['Balshaw, Robert F', 'English, Krista', 'Mak, Sunny', 'Otterstatter, Michael C']",['Pandemic Preparedness'],100000.0,313958,"Globally, the threat of Emerging Infectious Diseases (EIDs) is on the rise. Significant time and resources have been invested in the development of pandemic preparedness plans, designed to prevent or mitigate the impact of an EID pandemic. With the emergence of SARS in 2003, and novel influenza in 2009, these plans were challenged to ensure public health and security, quickly and with little information about the new EIDs. These experiences demonstrated that despite the best efforts to prepare for such events, real-time management of EIDs is often marked by confusion and uncertainty. 
Following post-pandemic consultations with international experts in pandemic planning research and decision-making, we better understand how to improve our responses. We have compiled their recommendations to address the knowledge gaps in planning for pandemic outbreaks and public health emergencies. The most prominent recommendations include developing methods to combine emerging infectious disease surveillance data with dynamic demographic mathematical models to rapidly understand and control an EID. 
This will allow researchers to understand how quickly an EID spreads and generate real-time control options for policymakers. The mathematical model addresses the specific characteristics of the BC population to determine exactly what options would best stop the spread of disease in this province. In parallel, we will conduct a complementary project to understand how this research becomes the basis for new policy during an emergency situation. This will ensure the most efficient flow of research to policy makers for future public health emergencies.
With the relevant regional demographic and surveillance data, these advanced frameworks can be implemented in other regions, both nationally and internationally. By focusing on real-time pandemic management options, we will provide tools to control EIDs in an effective way, reducing both the health and economic burden of these diseases."
Sharing the Lay of the Land: Developing an APHA Leadership Intervention Initiative,"['Masching, Renee', 'Loppie, Charlotte J']","['Bilsborrow, Priscilla P', 'Nobis, Anthony J', 'Peltier, Doris J', 'Cain, Roy']","['Aboriginal People Living With Hiv/Aids', 'Community-Based Research', 'Gipa', 'Hiv/Aids', 'Leadership']",33000.0,209428,"Current reports confirm that HIV/AIDS continues to disproportionately impact Aboriginal peoples in Canada. Intervention research represents a promising approach through which this critical health disparity might be addressed. Peer education, mobilization and support have emerged as integral components of prevention efforts as well as campaigns aimed at improving the health of those living with HIV and AIDS. Over the past 13 years, the Canadian Aboriginal AIDS Network (CAAN) has evolved from the initial National Aboriginal People living with HIV/AIDS Network (NAPHAN) to a leader in research, prevention and health promotion activities for Aboriginal Peoples living with or affected by HIV/AIDS. Recently, the CAAN Aboriginal People living with HIV/AIDS (APHA) Caucus and APHA Advisory Committee prioritized the development of a long term, strategic Leadership Initiative that emphasizes peer education, mobilization and support. The notion of engaging APHAs as peer-leaders in the fight against HIV/AIDS amoung Aboriginal peoples was first proposed in 2007: it is now clear that resources are required to organize current knowledge and unite key stakeholders. Catalyst grant funds are sought to support the Principle Investigators, team members and APHA Leadership Development sub-committee members to meet with APHA stakeholders, community and academic researchers to strengthen partnerships relevant to this specific initiative and prepare a full application to undertake a community-based intervention research project. This will ultimately assist CAAN in developing the knowledge necessary to carry out our HIV/AIDS work by effectively engaging and supporting APHA Leadership."
